### ISSUE TITLE
last error: could not determine the zone: unexpected response code 'SERVFAIL'

### ISSUE THREAD

**Issue by dsantanu** [vancluever/terraform-provider-acme#286]
Hi there,

I'm using following piece of TF to to get a SAN certificate using `route53` provider: 

```
resource "acme_registration" "regn" {
  account_key_pem = tls_private_key.pkey.private_key_pem
  email_address   = var.regd_email
}

resource "acme_certificate" "cert" {
  account_key_pem           = acme_registration.regn.account_key_pem
  common_name               = var.common_name
  subject_alternative_names = var.san_domains

  recursive_nameservers = ["8.8.8.8:53"]
  #disable_complete_propagation = true

  dns_challenge {
    provider = "route53"
    config = {
      AWS_ASSUME_ROLE_ARN     = var.assume_role_arn
      AWS_HOSTED_ZONE_ID      = var.hosted_zone_id
      #AWS_PROPAGATION_TIMEOUT = 600
    }
  }
}
```

I see all of the TXT records are being created during the **`Still creating....`** (checking in the Route53 cinsole) but after 10 mins or so, it fails with this error message:  

> **Error: error creating certificate: error: one or more domains had a problem:
[admin.mydomain.co.uk] time limit exceeded: last error: could not determine the zone: unexpected response code 'SERVFAIL' for _acme-challenge.admin.mydomain.co.uk.
[mydomain.co.uk] time limit exceeded: last error: could not determine the zone: unexpected response code 'SERVFAIL' for _acme-challenge.mydomain.co.uk.**

It doesn't matter if I do only for the main-domain or the including the Sub/SAN domains - it times out in the end with the `last error` as mentioned in the title. I've tried out various things (from the net) for last couple of days but no avail.

I read somewhere that underlying _*lego*_ doesn't play very well with IPv6, so I disabled that on the machine running TF as well, but still no joy. Does anyone know if it's a hidden bug or what am I doing wrong? Really appreciate any help, anyone can offer.

-S

**Comment by vancluever** [comment]
@dsantanu can you try using the [`AWS_HOSTED_ZONE_ID`](https://registry.terraform.io/providers/vancluever/acme/latest/docs/guides/dns-providers-route53#AWS_HOSTED_ZONE_ID) parameter to force the zone ID and see what happens? It's possible that there's some issue in your machine's ability to discover the zone ID for the the particular zone.

**Comment by dsantanu** [comment]
Hi @vancluever, thanks for getting back to me.
I already have `AWS_HOSTED_ZONE_ID` as one of the config parameters under the `dns_challenge{ ... }`. did you mean something else? 
Just as a side note, It works oerfectly fine if I use `acme.sh` though.

**Comment by dsantanu** [comment]
@vancluever,

I'm not a _tcpdump_ expert, but loads of these I can see during the TF run:
```
root@mybuntu:~# tcpdump -i enp0s1 -n -s 0 port 53
tcpdump: verbose output suppressed, use -v[v]... for full protocol decode
listening on enp0s1, link-type EN10MB (Ethernet), snapshot length 262144 bytes
00:30:26.075872 IP 10.0.2.15.58579 > 8.8.8.8.53: 60096+ [1au] TXT? _acme-challenge.admin.MYDOMAIN.co.uk. (66)
00:30:26.081025 IP 8.8.8.8.53 > 10.0.2.15.58579: 60096 ServFail 0/0/1 (66)
00:30:26.081546 IP 10.0.2.15.52056 > 8.8.8.8.53: 47990+ [1au] SOA? _acme-challenge.admin.MYDOMAIN.co.uk. (66)
00:30:26.085785 IP 8.8.8.8.53 > 10.0.2.15.52056: 47990 ServFail 0/0/1 (66)
00:30:30.093669 IP 10.0.2.15.48676 > 8.8.8.8.53: 37915+ [1au] TXT? _acme-challenge.admin.MYDOMAIN.co.uk. (66)
00:30:30.299037 IP 8.8.8.8.53 > 10.0.2.15.48676: 37915 ServFail 0/0/1 (66)
00:30:30.299761 IP 10.0.2.15.60679 > 8.8.8.8.53: 64372+ [1au] SOA? _acme-challenge.admin.MYDOMAIN.co.uk. (66)
00:30:31.122859 IP 8.8.8.8.53 > 10.0.2.15.60679: 64372 ServFail 0/0/1 (66)
00:30:35.125995 IP 10.0.2.15.52255 > 8.8.8.8.53: 46249+ [1au] TXT? _acme-challenge.admin.MYDOMAIN.co.uk. (66)
00:30:35.135039 IP 8.8.8.8.53 > 10.0.2.15.52255: 46249 ServFail 0/0/1 (66)
00:30:35.135521 IP 10.0.2.15.47696 > 8.8.8.8.53: 52718+ [1au] SOA? _acme-challenge.admin.MYDOMAIN.co.uk. (66)
00:30:35.139764 IP 8.8.8.8.53 > 10.0.2.15.47696: 52718 ServFail 0/0/1 (66)
00:30:39.144282 IP 10.0.2.15.33836 > 8.8.8.8.53: 4097+ [1au] TXT? _acme-challenge.admin.MYDOMAIN.co.uk. (66)
00:30:39.978846 IP 8.8.8.8.53 > 10.0.2.15.33836: 4097 ServFail 0/0/1 (66)
00:30:39.979581 IP 10.0.2.15.35730 > 8.8.8.8.53: 25855+ [1au] SOA? _acme-challenge.admin.MYDOMAIN.co.uk. (66)
00:30:40.695462 IP 8.8.8.8.53 > 10.0.2.15.35730: 25855 ServFail 0/0/1 (66)
00:30:44.700068 IP 10.0.2.15.45079 > 8.8.8.8.53: 8359+ [1au] TXT? _acme-challenge.admin.MYDOMAIN.co.uk. (66)
00:30:44.712301 IP 8.8.8.8.53 > 10.0.2.15.45079: 8359 ServFail 0/0/1 (66)
00:30:44.712729 IP 10.0.2.15.59504 > 8.8.8.8.53: 21966+ [1au] SOA? _acme-challenge.admin.MYDOMAIN.co.uk. (66)
00:30:44.716992 IP 8.8.8.8.53 > 10.0.2.15.59504: 21966 ServFail 0/0/1 (66)
00:30:48.722552 IP 10.0.2.15.47131 > 8.8.8.8.53: 61611+ [1au] TXT? _acme-challenge.admin.MYDOMAIN.co.uk. (66)
00:30:49.093897 IP 8.8.8.8.53 > 10.0.2.15.47131: 61611 ServFail 0/0/1 (66)
00:30:49.094502 IP 10.0.2.15.53518 > 8.8.8.8.53: 34651+ [1au] SOA? _acme-challenge.admin.MYDOMAIN.co.uk. (66)
00:30:49.149436 IP 8.8.8.8.53 > 10.0.2.15.53518: 34651 ServFail 0/0/1 (66)`
.......
```
Is there any particular command you wnat me to run?

**Comment by vancluever** [comment]
@dsantanu were you using the Google DNS for any particular reason? Not too sure why they would be rejecting TXT record queries with SERVFAIL instead of something like NXDOMAIN but yeah. I'm assuming you checked the zone, and then did a local lookup for the TXT record yourself?

PS: If this continues and you just want to move on, you can try setting [`disable_complete_propagation`](https://registry.terraform.io/providers/vancluever/acme/latest/docs/resources/certificate#disable_complete_propagation) to skip this check. Make sure you heed the warnings in the linked subsection though.

**Comment by dsantanu** [comment]
Okay, first if all there was stupid mistake from my side: I had to recrete the resuable delegation-sets and forgot to update the new NS-record with the domain-register. since I have updatd the record, the `ServFail` error has gone. 

But still no luck. I have two senerio now. 
IF I use `disable_complete_propagation` I end up with this error:

> **Error: error creating certificate: error: one or more domains had a problem:
[admin.MYDOMAIN.co.uk] acme: error: 400 :: urn:ietf:params:acme:error:dns :: DNS problem: NXDOMAIN looking up TXT for _acme-challenge.admin.MYDOMAIN.co.uk - check that a DNS record exists for this domain
[schools01.MYDOMAIN.co.uk] acme: error: 400 :: urn:ietf:params:acme:error:dns :: DNS problem: NXDOMAIN looking up TXT for _acme-challenge.schools01.MYDOMAIN.co.uk - check that a DNS record exists for this domain**

I can confirm that records are definately created during the TF run and removed later but it's looking for the record and being failed

IF I remove `disable_complete_propagation`, I end up with this now after about 7 mins of running:

> **Error: error creating certificate: error: one or more domains had a problem:
[admin.MYDOMAIN.co.uk] time limit exceeded: last error: NS ns-1983.awsdns-55.co.uk. returned NXDOMAIN for _acme-challenge.admin.MYDOMAIN.co.uk.
[schools01.MYDOMAIN.co.uk] time limit exceeded: last error: NS ns-1570.awsdns-04.co.uk. returned NXDOMAIN for _acme-challenge.schools01.MYDOMAIN.co.uk.**

The odd things I noticed, for both of the cases, there were TXT record for sub-domains (e.g.```admin.MYDOMAIN.com```) but not for the main-domain: MYDOMAIN.com

It may created and removed very quickly but Ididn't able to catch it in between the page refresh.

-S

**Comment by dsantanu** [comment]
okay, I have made some progress and what I see it's failing in trhe SAN domains. If there is no SAN/Sub-domains it finishes within 3 sec. or so.

@vancluever - how does it actually check the TXT record? My SAN domains are the sub-domains of my main-domain i.e. there is a matching NS record in the main-domain hosted-zone (white-label) and it's failing for 'em.

**Comment by vancluever** [comment]
@dsantanu so you mean you're delegating the sub-domains, I'm guessing?

I'd imagine that they're being delegated to different zones, so it's possible `AWS_HOSTED_ZONE_ID` might be causing problems for you, this will force every challenge into the specified zone. This is a bit of an implicit limitation with how the provider (and to an extent lego) currently works.

Did you happen to try removing that yet? If you can do that, the route53 provider may be able to discover the hosted zone IDs for each domain (FQDN) in the certificate.

**Comment by dsantanu** [comment]
Yes, they are delegated to different zones. 
I haven't tried removing the `AWS_HOSTED_ZONE_ID` yet but I'll give it a try now. The `acme.sh` workes without any issue that way, so probably prossible do with provider as well? I'll report back soon.

-S

**Comment by dsantanu** [comment]
Okay, finally it worked without the `AWS_HOSTED_ZONE_ID`!!!
Thanks @vancluever for your support and assistance 👍

**Comment by vancluever** [comment]
Glad it's all working for you now @dsantanu!
